attempt_order	candidate_rank	candidate_id	object	status	authoritative_location	observed_2026_07_16	disposition_or_reason	accession_or_version	staged_path	sha256
1	1	DGRP_Freeze2	legacy pre-called VCF directory	unavailable	ftp://ftp.hgsc.bcm.edu/DGRP/freeze2_Feb_2013/vcf_files/	FTP 550 No such directory after anonymous login	Legacy BCM directory is gone; continued within ranked DGRP to the authoritative Drosophila Genome Nexus DGRP sequence release rather than stopping	DGRP Freeze 2 February 2013	NA	NA
2	1	DGRP_DGN1.1	DGRP reference-numbered consensus sequence archive	accepted_source	https://pooldata.genetics.wisc.edu/dgrp_sequences.tar.bz2	HTTP 200; 5293037710 bytes; provider MD5 c697730b0720e944ab2be32e391322b0 verified	Authoritative DGN DGRP SEQ is a reproducible all-sites source: provider documents A/C/G/T/N reference-numbered Release 5 consensus sequences and N masking of failed, indel-adjacent, and heterozygous sites	Drosophila Genome Nexus 1.1 / DGRP SEQ	/moosefs/erikg/tier3scratch/tier3b-acquisition/dgrp_dgn1.1/source/dgrp_sequences.tar.bz2	65c63073f14ea02db0421983b5bdd9e8c6434cd8aa1cc5d893d42e6413f02528
3	1	DGRP_DGN1.1	exact reference FASTA	accepted_source	https://s3ftp.flybase.org/genomes/Drosophila_melanogaster/dmel_r5.57_FB2014_03/fasta/dmel-all-chromosome-r5.57.fasta.gz	HTTP 206/200 and complete download	Exact Release 5.57 reference used for DGN reference numbering; no lift or congener substitution	FlyBase FB2014_03 / Dmel Release 5.57	/moosefs/erikg/tier3scratch/tier3b-acquisition/dgrp_dgn1.1/source/dmel-all-chromosome-r5.57.fasta.gz	97fa0315f35bc0b659a2f65ff4e49a1b63aaef31950a6343511873615a35591b
4	1	DGRP_DGN1.1	original native annotation	accepted_source	https://s3ftp.flybase.org/genomes/Drosophila_melanogaster/dmel_r5.57_FB2014_03/gff/dmel-all-r5.57.gff.gz	HTTP 206/200 and complete download	Original FlyBase Release 5.57 GFF retained byte-for-byte; no projected, lifted, congener, or de novo annotation	FlyBase FB2014_03 / FBrf0230721 / Dmel Release 5.57	/moosefs/erikg/tier3scratch/tier3b-acquisition/dgrp_dgn1.1/source/dmel-all-r5.57.gff.gz	af0babdbc3fa76bd7a1cfb4e63d4e3f31d9cebdbef8354a1428bce3f98872fdc
5	1	DGRP_DGN1.1	assembled biological tuple qualification	disqualified	https://www.johnpool.net/genomes.html and https://s3ftp.flybase.org/genomes/Drosophila_melanogaster/dmel_r5.57_FB2014_03/	DGRP VCF has 1000000 REF-compatible records, 25652 polymorphic records, 20 samples, and 831671 callable bases; however all 15 native GFF sequence-region bounds exceed the exact FASTA lengths by 1 or 2 bases	Fail closed: the original native FlyBase r5.57 GFF cannot satisfy the downstream exact annotation/reference dictionary gate; no trimming, replacement, lift, projection, or de novo annotation was permitted. Continued to ranked Ag1000G.	DGN1.1 / FlyBase FB2014_03 r5.57	/moosefs/erikg/tier3scratch/tier3b-acquisition/dgrp_dgn1.1/staged/dgrp_ral.2L_5000000_5999999.all_sites.vcf.gz	cae32ae39e4284dd66a73cc7eff2024e63a8a422fa10c4d4ba89b7b7096d5304
6	2	Ag1000G_Ag3	canonical release manifest	unavailable	https://storage.googleapis.com/vo_agam_release/v3/manifest.tsv	HTTP 403; alternate XML/API object request HTTP 401	Canonical bucket now denies anonymous object access; continued to MalariaGEN's live public object endpoints and temporary public release bucket	Ag1000G Ag3.0 phase 3	NA	NA
7	2	Ag1000G_Ag3	per-sample all-sites VCFs	accepted_source	https://vo_agam_output.cog.sanger.ac.uk/{sample_id}.vcf.gz	HTTP 206 for every selected VCF and TBI; VCF header says GATK 3.7 EMIT_ALL_SITES on AgamP4	Twenty exact provider objects per tuple are deterministically named by each checksum-frozen selected sample list and merged only over the recorded region	Ag1000G Ag3.0 phase 3	see acquisition_manifest.tsv	composite_checksum_in_manifest
8	2	Ag1000G_Ag3	exact reference FASTA	accepted_source	https://storage.googleapis.com/vo_anoph_temp_us_central1/vo_agam_release/reference/genome/agamp4/Anopheles-gambiae-PEST_CHROMOSOMES_AgamP4.fa.gz	HTTP 200 and complete download	Exact AgamP4 FASTA named in all selected VCF headers	INSDC GCA_000005575.1 / AgamP4	/moosefs/erikg/tier3scratch/tier3b-acquisition/ag1000g_phase3/source/Anopheles-gambiae-PEST_CHROMOSOMES_AgamP4.fa.gz	dfc36404e9094d3dcdefbc1a4c3cc24636fa02f1abea2e3721d02ef71bbcb643
9	2	Ag1000G_Ag3	original native annotation	accepted_source	https://storage.googleapis.com/vo_anoph_temp_us_central1/vo_agam_release/reference/genome/agamp4/Anopheles-gambiae-PEST_BASEFEATURES_AgamP4.12.gff3.gz	HTTP 200 and complete download	Original VectorBase/MalariaGEN AgamP4.12 GFF retained byte-for-byte; no projected, lifted, congener, or de novo annotation	VectorBase AgamP4.12	/moosefs/erikg/tier3scratch/tier3b-acquisition/ag1000g_phase3/source/Anopheles-gambiae-PEST_BASEFEATURES_AgamP4.12.gff3.gz	9329b95dc4daff2ee084674bb693bc8e3647dbf84831e758a1c2ce8179632e3b
10	2	Ag1000G_Ag3	provider site-filter denominator	accepted_source	https://storage.googleapis.com/vo_anoph_temp_us_central1/vo_agam_release/v3/site_filters/dt_20200416/vcf/gamb_colu/3R_sitefilters.vcf.gz	HTTP 200; indexed 3R dictionary length 53200684 and 52226568 records	Provider FILTER=PASS sites are intersected with exact-cohort GT/DP/GQ completeness; resulting BED counts and checksums are tuple-specific	Ag3 dt_20200416 gamb_colu	/moosefs/erikg/tier3scratch/tier3b-acquisition/ag1000g_phase3/source/3R_sitefilters.gamb_colu.dt_20200416.vcf.gz	25f6a1e77750d9defac12f9d74b225cc7af949a2569a16eefd0a8ae797f9900f
11	2	Ag1000G_Ag3	population/sample metadata	accepted_source	https://raw.githubusercontent.com/malariagen/ag1000g-phase3-data-paper/master/content/tables/per_sample_location_table.csv	HTTP 200 and complete download	Native Ag3 paper metadata supplies sample set, locality, year, and species assignment used for deterministic population selection	Ag1000G phase 3 data paper	/moosefs/erikg/tier3scratch/tier3b-acquisition/ag1000g_phase3/source/per_sample_location_table.csv	5a7e4cde5b1afff36410066f3297f1c861fa6c692e197a8ee03694038cf22a6c
12	3	other_authoritative_high_Ne	fallback search	not_needed	CaeNDR, Drosophila simulans 170-line panel, Aedes 1206-genome panel	Not attempted after ranked DGRP and Ag1000G yielded the required biological minimum	Rank-3 alternatives remain fallbacks; no rejection is inferred and no candidate is counted toward success	N/A	NA	NA
13	2	Ag1000G_Ag3	frozen 1-Mb tuple power preflight	replaced_insufficient	results/tier3b/acquisition_manifest.tsv at pre-repair commit bdd1098	Pinned-Guix Slurm job 1761600 streamed both original exact tuples: AO S=21824/W=8070, GM S=21825/W=8070, and one eligible ratio block each	Failing preflight reproduced and preserved before replacement; original VCFs, indexes, callable masks, and their checksums remain untouched	tier3-decisions-v1	/moosefs/erikg/tier3scratch/tier3b-acquisition/repair-logs/current-preflight.json	0630bb0aeb8b34b52422912a88730e10a0b90eb3a7d7ffd369821333015d4542
14	2	Ag1000G_Ag3_AO_repair	extended exact-cohort all-sites tuple	accepted_replacement	https://vo_agam_output.cog.sanger.ac.uk/{locked_AO_sample_id}.vcf.gz	Pinned-Guix Slurm acquisition job 1761599 merged the identical checksum-locked 20-sample AO cohort over 3R:10000000-30999999; 20817962 records; full REF/sample/index/callability gates pass	Approved AO row replaced only after base and frozen-power validation; original 1-Mb row objects preserved	Ag1000G Ag3.0 phase 3 / AG1000G-AO	/moosefs/erikg/tier3scratch/tier3b-acquisition/repair-3R_10000000_30999999-v1/ao/ao_luanda_coluzzii.3R_10000000_30999999.all_sites.vcf.gz	6d86edaed3976d11219bf128512a1e8d71e6b6eb2301159d46bcba8fdf68d812
15	2	Ag1000G_Ag3_GM_repair	extended exact-cohort all-sites tuple	accepted_replacement	https://vo_agam_output.cog.sanger.ac.uk/{locked_GM_sample_id}.vcf.gz	Pinned-Guix Slurm acquisition job 1761599 merged the identical checksum-locked 20-sample GM cohort over 3R:10000000-30999999; 20817962 records; full REF/sample/index/callability gates pass	Approved GM row replaced only after base and frozen-power validation; original 1-Mb row objects preserved	Ag1000G Ag3.0 phase 3 / AG1000G-GM-C	/moosefs/erikg/tier3scratch/tier3b-acquisition/repair-3R_10000000_30999999-v1/gm/gm_walikunda_coluzzii.3R_10000000_30999999.all_sites.vcf.gz	54fd59c25ebcec1fad84aff50c494e5e8cfc3e35ba32d10fc81aee06430319ed
16	2	Ag1000G_Ag3_repair	frozen 4D and block-power audit	accepted_validation	results/tier3b/acquisition_repair_power.py	Pinned-Guix Slurm job 1761601 streamed 20817962 records per tuple: AO S=190133/W=56419/21 blocks; GM S=190179/W=56451/21 blocks	Both replacement tuples exceed frozen >=10000 S/W and >=20 eligible 1-Mb block gates without lowering policy thresholds	tier3-decisions-v1	/moosefs/erikg/tier3scratch/tier3b-acquisition/repair-3R_10000000_30999999-v1/acquisition_power_qc.json	696f487f89af8e903e4183b76a6389299ffa3995070702085de0469b53bb4b21
17	2	Ag1000G_Ag3_repair	Slurm accounting provenance	accepted_validation	Slurm sacct for jobs 1761599,1761600,1761601	All jobs COMPLETED on octopus07 with exit 0:0; elapsed 01:35:41, 00:07:23, and 01:31:34 respectively	Exact accounting output retained; blank backend CPU/RSS values are not imputed	Slurm cluster accounting 2026-07-16	/moosefs/erikg/tier3scratch/tier3b-acquisition/repair-3R_10000000_30999999-v1/slurm_sacct.tsv	7d67a6878540749eeb0126408bc4f53d51fa32dad233c1f8130308aa35f915a2
